{
  "bindingId": "prep-list:component:example-123:add-item",
  "action": {
    "id": "prep_list.add_item",
    "version": 1
  },
  "driver": "livewire",
  "lifecycle": "component",
  "target": {
    "componentId": "example-123",
    "method": "addItem",
    "inputOrder": [
      "name"
    ],
    "requiredCount": 1
  },
  "expiresAt": null
}
